{
  "contract_version": "data-lens-method-manifest/1.0",
  "method_id": "data_lens.evidence_gated_deep_findings",
  "version": "1.3.0",
  "status": "experimental",
  "name": "证据门控的深度发现引擎",
  "purpose": "Separate semantic finding candidates from adopted findings and anchor findings by checking scope readiness, claim permission, design-result alignment, source evidence, counterexamples, competing explanations, robustness, and decision value.",
  "question_types": ["description", "comparison", "diagnosis", "explanation", "prediction", "causal_effect", "decision"],
  "accepted_units": ["finding_candidate", "verified_evidence_card", "anchor_finding"],
  "input_shapes": ["deep_finding_candidate_json", "deep_evidence_card_set", "compiled_corpus_scope_gate", "optional_deep_analysis_plan"],
  "eligibility_checks": ["scope gate permits analysis", "decision question matches scope gate", "support evidence is verified and inside the selected family", "counterexample search is complete", "prediction, causal-effect, and decision-rule claims have a freshly recompiled plan, an allowed analysis layer, a trusted result adapter, hashed input provenance, a supported claim design, and exact honest-split, uncertainty, overlap, estimator, and sensitivity bindings when those methods are planned"],
  "assumptions": ["evidence roles and independence groups are reviewed before anchor eligibility is evaluated"],
  "human_gates": ["review semantic claim level", "confirm competing explanations and robustness checks fit the route"],
  "implementation": {"runtime": "python", "entrypoint": "scripts/compile_deep_findings.py", "network_policy": "deny", "optional_dependencies": []},
  "outputs": ["contract errors", "evidence errors", "claim-permission errors", "canonical measured claims", "required-layer readiness", "completed result coverage by analytical layer", "deep quality checks", "finding adoption ledger", "anchor-finding status"],
  "diagnostics": ["contract, evidence, counterexample, competing-explanation, robustness, and anchor-gate results"],
  "evidence_requirements": ["locatable verified evidence", "analysis unit and independence group", "counterexample result", "robustness evidence", "decision boundary", "derived analysis_result evidence for advanced claims", "completed and plan-bound analysis coverage evidence for every required substantive layer"],
  "allowed_claims": ["a bounded finding passed declared gates", "an anchor finding is eligible to answer the core question", "an advanced claim is confined to its compiled target, method, assumptions, and supported result evidence"],
  "forbidden_claims": ["request success equals adoption", "an adopted angle answers the core question", "mechanism hypothesis is causal proof", "a ready analysis plan is itself a validated effect", "report length proves depth"],
  "validation": {"status": "regression_tested", "fixtures": ["fixtures/deep-findings"]}
}
